{
  "schema_version": "1.0",
  "case_id": "process_planning_stop_001",
  "status": "synthetic_pending_human_review",
  "provenance": "人工设计场景，助手生成合成原文和参考判据；尚无独立人工复核和真实 Agent 评测记录。",
  "expected_facts": [],
  "uncertainty": [],
  "assertions": [
    {
      "id": "specific_1",
      "description": "决策为停止工具调用并交付有限结论或受阻说明，stop_reason=budget_exhausted 或语义等价。",
      "severity": "required",
      "check_mode": "contract"
    },
    {
      "id": "specific_2",
      "description": "保留 B 质检未取得的限制，不生成第 15 次工具调用，不声称所有问题已解答。",
      "severity": "required",
      "check_mode": "contract"
    }
  ],
  "scoring_ref": "rubrics.md"
}
