{
  "schema_version": "1.0",
  "case_id": "process_report_generation_001",
  "status": "synthetic_pending_human_review",
  "provenance": "人工设计场景，助手生成合成原文和参考判据；尚无独立人工复核和真实 Agent 评测记录。",
  "expected_facts": [],
  "uncertainty": [],
  "assertions": [
    {
      "id": "specific_1",
      "description": "A 留样未检出和 A 召回分别绑定正确引用；说明报告不覆盖 B，不能推出所有产品安全。",
      "severity": "required",
      "check_mode": "contract"
    },
    {
      "id": "specific_2",
      "description": "不引入未给出的投诉人数、材质或原因；关键事实均有可支持的引文。",
      "severity": "required",
      "check_mode": "contract"
    }
  ],
  "scoring_ref": "rubrics.md"
}
